{
  "version": "1.0",
  "generated_at": "2025-04-19T11:00:00Z",
  "verify_was_failing": false,
  "dimensions": [
    {"name": "problem_clarity", "score": 4, "deduction_reason": "Clear one-liner.",
     "judge_questions": ["Who is the target user?", "How do they solve this today?"],
     "improvements": ["Show a user quote slide."]},
    {"name": "originality", "score": 3, "deduction_reason": "Notes apps are crowded; sync is the wedge.",
     "judge_questions": ["What is novel vs Notion?", "Who else has tried this?"],
     "improvements": ["Open with the 3-second sync demo, not a feature list."]},
    {"name": "completeness", "score": 4, "deduction_reason": "Demo path works; billing stub.",
     "judge_questions": ["Does billing work end-to-end?", "Is the demo path complete?"],
     "improvements": ["Mock the Stripe webhook in demo mode."]},
    {"name": "technical_depth", "score": 3, "deduction_reason": "Standard stack.",
     "judge_questions": ["What was the hardest engineering decision?", "Why this stack?"],
     "improvements": ["Explain CRDT vs last-write-wins in 30 seconds."]},
    {"name": "demo_quality", "score": 4, "deduction_reason": "60s script present.",
     "judge_questions": ["Will the demo run on stage wifi?", "What happens if the API is down?"],
     "improvements": ["Pre-cache the landing page; rehearse twice."]},
    {"name": "business_value", "score": 3, "deduction_reason": "Beachhead unclear.",
     "judge_questions": ["Who pays for this?", "What is the wedge?"],
     "improvements": ["Add 'free for 1 device, $5/mo for sync'."]},
    {"name": "submission_readiness", "score": 3, "deduction_reason": "Demo video missing.",
     "judge_questions": ["Can a judge clone and run it?", "Is the README complete?"],
     "improvements": ["Record 30s demo video; add to README."]}
  ],
  "overall": 3.43,
  "fix_priorities": {
    "fix_now": [
      "[completeness] Mock the Stripe webhook in demo mode.",
      "[submission_readiness] Record 30s demo video; add to README."
    ],
    "fix_last_10min": [
      "[problem_clarity] Show a user quote slide.",
      "[business_value] Add 'free for 1 device, $5/mo for sync'."
    ],
    "do_not_touch": [
      "[demo_quality] Pre-cache the landing page; rehearse twice.",
      "[originality] Open with the 3-second sync demo, not a feature list."
    ]
  }
}
